{
  "format": "mathos-substrate-run",
  "schemaVersion": 1,
  "name": "Reference substrate",
  "seed": 42,
  "universe": {
    "width": 64,
    "height": 64
  },
  "engine": {
    "id": "substrate-reference",
    "version": 1
  },
  "rng": {
    "id": "mulberry32",
    "version": 1
  },
  "initializer": {
    "id": "uniform-noise",
    "version": 1
  },
  "rules": {
    "id": "conservative-transport",
    "version": 1,
    "boundary": "periodic",
    "transferDivisor": 8
  }
}
